<?xml version="1.0" encoding="UTF-8"?>
<!DOCTYPE topology SYSTEM "hwloc2.dtd">
<topology version="2.0">
  <object type="Machine" os_index="0" cpuset="0xf0f0f0f0" complete_cpuset="0xf0f0f0f0" allowed_cpuset="0xf0f0f0f0" nodeset="0x00000003" complete_nodeset="0x00000003" allowed_nodeset="0x00000003" gp_index="1">
    <object type="Group" cpuset="0x0000f0f0" complete_cpuset="0x0000f0f0" nodeset="0x00000001" complete_nodeset="0x00000001" gp_index="74" kind="1001" subkind="0">
      <object type="NUMANode" os_index="0" cpuset="0x0000f0f0" complete_cpuset="0x0000f0f0" nodeset="0x00000001" complete_nodeset="0x00000001" gp_index="2" local_memory="31943819264">
        <page_type size="65536" count="487424"/>
        <page_type size="16777216" count="0"/>
      </object>
      <object type="PU" os_index="4" cpuset="0x00000010" complete_cpuset="0x00000010" nodeset="0x00000001" complete_nodeset="0x00000001" gp_index="8"/>
      <object type="PU" os_index="5" cpuset="0x00000020" complete_cpuset="0x00000020" nodeset="0x00000001" complete_nodeset="0x00000001" gp_index="9"/>
      <object type="PU" os_index="6" cpuset="0x00000040" complete_cpuset="0x00000040" nodeset="0x00000001" complete_nodeset="0x00000001" gp_index="10"/>
      <object type="PU" os_index="7" cpuset="0x00000080" complete_cpuset="0x00000080" nodeset="0x00000001" complete_nodeset="0x00000001" gp_index="11"/>
      <object type="PU" os_index="12" cpuset="0x00001000" complete_cpuset="0x00001000" nodeset="0x00000001" complete_nodeset="0x00000001" gp_index="16"/>
      <object type="PU" os_index="13" cpuset="0x00002000" complete_cpuset="0x00002000" nodeset="0x00000001" complete_nodeset="0x00000001" gp_index="17"/>
      <object type="PU" os_index="14" cpuset="0x00004000" complete_cpuset="0x00004000" nodeset="0x00000001" complete_nodeset="0x00000001" gp_index="18"/>
      <object type="PU" os_index="15" cpuset="0x00008000" complete_cpuset="0x00008000" nodeset="0x00000001" complete_nodeset="0x00000001" gp_index="19"/>
    </object>
    <object type="Group" cpuset="0xf0f00000" complete_cpuset="0xf0f00000" nodeset="0x00000002" complete_nodeset="0x00000002" gp_index="75" kind="1001" subkind="0">
      <object type="NUMANode" os_index="1" cpuset="0xf0f00000" complete_cpuset="0xf0f00000" nodeset="0x00000002" complete_nodeset="0x00000002" gp_index="20" local_memory="33554432000">
        <page_type size="65536" count="512000"/>
        <page_type size="16777216" count="0"/>
      </object>
      <object type="PU" os_index="20" cpuset="0x00100000" complete_cpuset="0x00100000" nodeset="0x00000002" complete_nodeset="0x00000002" gp_index="26"/>
      <object type="PU" os_index="21" cpuset="0x00200000" complete_cpuset="0x00200000" nodeset="0x00000002" complete_nodeset="0x00000002" gp_index="27"/>
      <object type="PU" os_index="22" cpuset="0x00400000" complete_cpuset="0x00400000" nodeset="0x00000002" complete_nodeset="0x00000002" gp_index="28"/>
      <object type="PU" os_index="23" cpuset="0x00800000" complete_cpuset="0x00800000" nodeset="0x00000002" complete_nodeset="0x00000002" gp_index="29"/>
      <object type="PU" os_index="28" cpuset="0x10000000" complete_cpuset="0x10000000" nodeset="0x00000002" complete_nodeset="0x00000002" gp_index="34"/>
      <object type="PU" os_index="29" cpuset="0x20000000" complete_cpuset="0x20000000" nodeset="0x00000002" complete_nodeset="0x00000002" gp_index="35"/>
      <object type="PU" os_index="30" cpuset="0x40000000" complete_cpuset="0x40000000" nodeset="0x00000002" complete_nodeset="0x00000002" gp_index="36"/>
      <object type="PU" os_index="31" cpuset="0x80000000" complete_cpuset="0x80000000" nodeset="0x00000002" complete_nodeset="0x00000002" gp_index="37"/>
    </object>
  </object>
</topology>
