<?xml version="1.0" encoding="UTF-8"?>
<!DOCTYPE topology SYSTEM "hwloc2.dtd">
<topology version="3.0">
  <object type="Machine" os_index="0" cpuset="0x00000003" complete_cpuset="0x00000003" allowed_cpuset="0x00000003" nodeset="0x00000001" complete_nodeset="0x00000001" allowed_nodeset="0x00000001">
    <object type="NUMANode" os_index="0" cpuset="0x00000003" complete_cpuset="0x00000003" nodeset="0x00000001" complete_nodeset="0x00000001"/>
    <object type="Package" os_index="0" cpuset="0x00000001" complete_cpuset="0x00000001" nodeset="0x00000001" complete_nodeset="0x00000001">
      <info name="CPUVendor" value="AuthenticAMD"/>
      <info name="CPUFamilyNumber" value="15"/>
      <info name="CPUModelNumber" value="5"/>
      <info name="CPUModel" value="AMD Opteron(tm) Processor 250"/>
      <info name="CPUStepping" value="10"/>
      <object type="L2Cache" cpuset="0x00000001" complete_cpuset="0x00000001" nodeset="0x00000001" complete_nodeset="0x00000001" cache_size="1048576" depth="2" cache_linesize="64" cache_associativity="16" cache_type="0">
        <object type="L1Cache" cpuset="0x00000001" complete_cpuset="0x00000001" nodeset="0x00000001" complete_nodeset="0x00000001" cache_size="65536" depth="1" cache_linesize="64" cache_associativity="2" cache_type="1">
          <object type="L1iCache" cpuset="0x00000001" complete_cpuset="0x00000001" nodeset="0x00000001" complete_nodeset="0x00000001" cache_size="65536" depth="1" cache_linesize="64" cache_associativity="2" cache_type="2">
            <object type="Core" os_index="0" cpuset="0x00000001" complete_cpuset="0x00000001" nodeset="0x00000001" complete_nodeset="0x00000001">
              <object type="PU" os_index="0" cpuset="0x00000001" complete_cpuset="0x00000001" nodeset="0x00000001" complete_nodeset="0x00000001" hw_id="0"/>
            </object>
          </object>
        </object>
      </object>
    </object>
    <object type="Package" os_index="1" cpuset="0x00000002" complete_cpuset="0x00000002" nodeset="0x00000001" complete_nodeset="0x00000001">
      <info name="CPUVendor" value="AuthenticAMD"/>
      <info name="CPUFamilyNumber" value="15"/>
      <info name="CPUModelNumber" value="5"/>
      <info name="CPUModel" value="AMD Opteron(tm) Processor 250"/>
      <info name="CPUStepping" value="10"/>
      <object type="L2Cache" cpuset="0x00000002" complete_cpuset="0x00000002" nodeset="0x00000001" complete_nodeset="0x00000001" cache_size="1048576" depth="2" cache_linesize="64" cache_associativity="16" cache_type="0">
        <object type="L1Cache" cpuset="0x00000002" complete_cpuset="0x00000002" nodeset="0x00000001" complete_nodeset="0x00000001" cache_size="65536" depth="1" cache_linesize="64" cache_associativity="2" cache_type="1">
          <object type="L1iCache" cpuset="0x00000002" complete_cpuset="0x00000002" nodeset="0x00000001" complete_nodeset="0x00000001" cache_size="65536" depth="1" cache_linesize="64" cache_associativity="2" cache_type="2">
            <object type="Core" os_index="0" cpuset="0x00000002" complete_cpuset="0x00000002" nodeset="0x00000001" complete_nodeset="0x00000001">
              <object type="PU" os_index="1" cpuset="0x00000002" complete_cpuset="0x00000002" nodeset="0x00000001" complete_nodeset="0x00000001" hw_id="1"/>
            </object>
          </object>
        </object>
      </object>
    </object>
  </object>
  <info name="Backend" value="x86"/>
</topology>
