<?xml version="1.0" encoding="UTF-8"?>
<!DOCTYPE topology SYSTEM "hwloc2.dtd">
<topology version="3.0">
  <object type="Machine" os_index="0" cpuset="0x0000747e" complete_cpuset="0x0000ffff" allowed_cpuset="0x0000747e" nodeset="0x00000006" complete_nodeset="0x0000000f" allowed_nodeset="0x00000006">
    <object type="Group" cpuset="0x0000000e" complete_cpuset="0x0000000f" nodeset="0x0" complete_nodeset="0x00000001" kind="1001" subkind="0">
      <object type="Core" os_index="0" cpuset="0x00000002" complete_cpuset="0x00000003" nodeset="0x0" complete_nodeset="0x00000001">
        <object type="PU" os_index="1" cpuset="0x00000002" complete_cpuset="0x00000002" nodeset="0x0" complete_nodeset="0x00000001"/>
      </object>
      <object type="Core" os_index="1" cpuset="0x0000000c" complete_cpuset="0x0000000c" nodeset="0x0" complete_nodeset="0x00000001">
        <object type="PU" os_index="2" cpuset="0x00000004" complete_cpuset="0x00000004" nodeset="0x0" complete_nodeset="0x00000001"/>
        <object type="PU" os_index="3" cpuset="0x00000008" complete_cpuset="0x00000008" nodeset="0x0" complete_nodeset="0x00000001"/>
      </object>
    </object>
    <object type="Group" cpuset="0x00000070" complete_cpuset="0x000000f0" nodeset="0x00000002" complete_nodeset="0x00000002" kind="1001" subkind="0">
      <object type="NUMANode" os_index="1" cpuset="0x00000070" complete_cpuset="0x000000f0" nodeset="0x00000002" complete_nodeset="0x00000002" local_memory="1073741824">
        <page_type size="4096" count="262144"/>
      </object>
      <object type="Core" os_index="2" cpuset="0x00000030" complete_cpuset="0x00000030" nodeset="0x00000002" complete_nodeset="0x00000002">
        <object type="PU" os_index="4" cpuset="0x00000010" complete_cpuset="0x00000010" nodeset="0x00000002" complete_nodeset="0x00000002"/>
        <object type="PU" os_index="5" cpuset="0x00000020" complete_cpuset="0x00000020" nodeset="0x00000002" complete_nodeset="0x00000002"/>
      </object>
      <object type="Core" os_index="3" cpuset="0x00000040" complete_cpuset="0x000000c0" nodeset="0x00000002" complete_nodeset="0x00000002">
        <object type="PU" os_index="6" cpuset="0x00000040" complete_cpuset="0x00000040" nodeset="0x00000002" complete_nodeset="0x00000002"/>
      </object>
    </object>
    <object type="Group" cpuset="0x00000400" complete_cpuset="0x00000f00" nodeset="0x00000004" complete_nodeset="0x00000004" kind="1001" subkind="0">
      <object type="NUMANode" os_index="2" cpuset="0x00000400" complete_cpuset="0x00000f00" nodeset="0x00000004" complete_nodeset="0x00000004" local_memory="1073741824">
        <page_type size="4096" count="262144"/>
      </object>
      <object type="Core" os_index="5" cpuset="0x00000400" complete_cpuset="0x00000c00" nodeset="0x00000004" complete_nodeset="0x00000004">
        <object type="PU" os_index="10" cpuset="0x00000400" complete_cpuset="0x00000400" nodeset="0x00000004" complete_nodeset="0x00000004"/>
      </object>
    </object>
    <object type="Group" cpuset="0x00007000" complete_cpuset="0x0000f000" nodeset="0x0" complete_nodeset="0x00000008" kind="1001" subkind="0">
      <object type="Core" os_index="6" cpuset="0x00003000" complete_cpuset="0x00003000" nodeset="0x0" complete_nodeset="0x00000008">
        <object type="PU" os_index="12" cpuset="0x00001000" complete_cpuset="0x00001000" nodeset="0x0" complete_nodeset="0x00000008"/>
        <object type="PU" os_index="13" cpuset="0x00002000" complete_cpuset="0x00002000" nodeset="0x0" complete_nodeset="0x00000008"/>
      </object>
      <object type="Core" os_index="7" cpuset="0x00004000" complete_cpuset="0x0000c000" nodeset="0x0" complete_nodeset="0x00000008">
        <object type="PU" os_index="14" cpuset="0x00004000" complete_cpuset="0x00004000" nodeset="0x0" complete_nodeset="0x00000008"/>
      </object>
    </object>
  </object>
  <info name="Backend" value="Synthetic"/>
  <info name="SyntheticDescription" value="numa:4 core:2 pu:2"/>
  <info name="LinuxCgroup" value="/dummy"/>
</topology>
