<?xml version="1.0" encoding="UTF-8"?>
<!DOCTYPE topology SYSTEM "hwloc2.dtd">
<topology version="3.0">
  <object type="Machine" os_index="0" cpuset="0x000000ff" complete_cpuset="0x000000ff" allowed_cpuset="0x000000ff" nodeset="0x00000001" complete_nodeset="0x00000001" allowed_nodeset="0x00000001">
    <object type="Package" os_index="0" cpuset="0x000000ff" complete_cpuset="0x000000ff" nodeset="0x00000001" complete_nodeset="0x00000001">
      <info name="CPUVendor" value="  Shanghai  "/>
      <info name="CPUFamilyNumber" value="6"/>
      <info name="CPUModelNumber" value="25"/>
      <info name="CPUModel" value="ZHAOXIN KaiSheng ZX-C+ FC-1081@2.0GHz"/>
      <info name="CPUStepping" value="0"/>
      <object type="NUMANode" os_index="0" cpuset="0x000000ff" complete_cpuset="0x000000ff" nodeset="0x00000001" complete_nodeset="0x00000001"/>
      <object type="L2Cache" cpuset="0x000000ff" complete_cpuset="0x000000ff" nodeset="0x00000001" complete_nodeset="0x00000001" cache_size="2097152" depth="2" cache_linesize="64" cache_associativity="16" cache_type="0">
        <object type="L1Cache" cpuset="0x00000001" complete_cpuset="0x00000001" nodeset="0x00000001" complete_nodeset="0x00000001" cache_size="32768" depth="1" cache_linesize="64" cache_associativity="8" cache_type="1">
          <object type="L1iCache" cpuset="0x00000001" complete_cpuset="0x00000001" nodeset="0x00000001" complete_nodeset="0x00000001" cache_size="32768" depth="1" cache_linesize="64" cache_associativity="8" cache_type="2">
            <object type="Core" os_index="0" cpuset="0x00000001" complete_cpuset="0x00000001" nodeset="0x00000001" complete_nodeset="0x00000001">
              <object type="PU" os_index="0" cpuset="0x00000001" complete_cpuset="0x00000001" nodeset="0x00000001" complete_nodeset="0x00000001" hw_id="0"/>
            </object>
          </object>
        </object>
        <object type="L1Cache" cpuset="0x00000002" complete_cpuset="0x00000002" nodeset="0x00000001" complete_nodeset="0x00000001" cache_size="32768" depth="1" cache_linesize="64" cache_associativity="8" cache_type="1">
          <object type="L1iCache" cpuset="0x00000002" complete_cpuset="0x00000002" nodeset="0x00000001" complete_nodeset="0x00000001" cache_size="32768" depth="1" cache_linesize="64" cache_associativity="8" cache_type="2">
            <object type="Core" os_index="1" cpuset="0x00000002" complete_cpuset="0x00000002" nodeset="0x00000001" complete_nodeset="0x00000001">
              <object type="PU" os_index="1" cpuset="0x00000002" complete_cpuset="0x00000002" nodeset="0x00000001" complete_nodeset="0x00000001" hw_id="1"/>
            </object>
          </object>
        </object>
        <object type="L1Cache" cpuset="0x00000004" complete_cpuset="0x00000004" nodeset="0x00000001" complete_nodeset="0x00000001" cache_size="32768" depth="1" cache_linesize="64" cache_associativity="8" cache_type="1">
          <object type="L1iCache" cpuset="0x00000004" complete_cpuset="0x00000004" nodeset="0x00000001" complete_nodeset="0x00000001" cache_size="32768" depth="1" cache_linesize="64" cache_associativity="8" cache_type="2">
            <object type="Core" os_index="2" cpuset="0x00000004" complete_cpuset="0x00000004" nodeset="0x00000001" complete_nodeset="0x00000001">
              <object type="PU" os_index="2" cpuset="0x00000004" complete_cpuset="0x00000004" nodeset="0x00000001" complete_nodeset="0x00000001" hw_id="2"/>
            </object>
          </object>
        </object>
        <object type="L1Cache" cpuset="0x00000008" complete_cpuset="0x00000008" nodeset="0x00000001" complete_nodeset="0x00000001" cache_size="32768" depth="1" cache_linesize="64" cache_associativity="8" cache_type="1">
          <object type="L1iCache" cpuset="0x00000008" complete_cpuset="0x00000008" nodeset="0x00000001" complete_nodeset="0x00000001" cache_size="32768" depth="1" cache_linesize="64" cache_associativity="8" cache_type="2">
            <object type="Core" os_index="3" cpuset="0x00000008" complete_cpuset="0x00000008" nodeset="0x00000001" complete_nodeset="0x00000001">
              <object type="PU" os_index="3" cpuset="0x00000008" complete_cpuset="0x00000008" nodeset="0x00000001" complete_nodeset="0x00000001" hw_id="3"/>
            </object>
          </object>
        </object>
        <object type="L1Cache" cpuset="0x00000010" complete_cpuset="0x00000010" nodeset="0x00000001" complete_nodeset="0x00000001" cache_size="32768" depth="1" cache_linesize="64" cache_associativity="8" cache_type="1">
          <object type="L1iCache" cpuset="0x00000010" complete_cpuset="0x00000010" nodeset="0x00000001" complete_nodeset="0x00000001" cache_size="32768" depth="1" cache_linesize="64" cache_associativity="8" cache_type="2">
            <object type="Core" os_index="4" cpuset="0x00000010" complete_cpuset="0x00000010" nodeset="0x00000001" complete_nodeset="0x00000001">
              <object type="PU" os_index="4" cpuset="0x00000010" complete_cpuset="0x00000010" nodeset="0x00000001" complete_nodeset="0x00000001" hw_id="4"/>
            </object>
          </object>
        </object>
        <object type="L1Cache" cpuset="0x00000020" complete_cpuset="0x00000020" nodeset="0x00000001" complete_nodeset="0x00000001" cache_size="32768" depth="1" cache_linesize="64" cache_associativity="8" cache_type="1">
          <object type="L1iCache" cpuset="0x00000020" complete_cpuset="0x00000020" nodeset="0x00000001" complete_nodeset="0x00000001" cache_size="32768" depth="1" cache_linesize="64" cache_associativity="8" cache_type="2">
            <object type="Core" os_index="5" cpuset="0x00000020" complete_cpuset="0x00000020" nodeset="0x00000001" complete_nodeset="0x00000001">
              <object type="PU" os_index="5" cpuset="0x00000020" complete_cpuset="0x00000020" nodeset="0x00000001" complete_nodeset="0x00000001" hw_id="5"/>
            </object>
          </object>
        </object>
        <object type="L1Cache" cpuset="0x00000040" complete_cpuset="0x00000040" nodeset="0x00000001" complete_nodeset="0x00000001" cache_size="32768" depth="1" cache_linesize="64" cache_associativity="8" cache_type="1">
          <object type="L1iCache" cpuset="0x00000040" complete_cpuset="0x00000040" nodeset="0x00000001" complete_nodeset="0x00000001" cache_size="32768" depth="1" cache_linesize="64" cache_associativity="8" cache_type="2">
            <object type="Core" os_index="6" cpuset="0x00000040" complete_cpuset="0x00000040" nodeset="0x00000001" complete_nodeset="0x00000001">
              <object type="PU" os_index="6" cpuset="0x00000040" complete_cpuset="0x00000040" nodeset="0x00000001" complete_nodeset="0x00000001" hw_id="6"/>
            </object>
          </object>
        </object>
        <object type="L1Cache" cpuset="0x00000080" complete_cpuset="0x00000080" nodeset="0x00000001" complete_nodeset="0x00000001" cache_size="32768" depth="1" cache_linesize="64" cache_associativity="8" cache_type="1">
          <object type="L1iCache" cpuset="0x00000080" complete_cpuset="0x00000080" nodeset="0x00000001" complete_nodeset="0x00000001" cache_size="32768" depth="1" cache_linesize="64" cache_associativity="8" cache_type="2">
            <object type="Core" os_index="7" cpuset="0x00000080" complete_cpuset="0x00000080" nodeset="0x00000001" complete_nodeset="0x00000001">
              <object type="PU" os_index="7" cpuset="0x00000080" complete_cpuset="0x00000080" nodeset="0x00000001" complete_nodeset="0x00000001" hw_id="7"/>
            </object>
          </object>
        </object>
      </object>
    </object>
  </object>
  <info name="Backend" value="x86"/>
</topology>
