<?xml version="1.0" encoding="UTF-8"?>
<!DOCTYPE topology SYSTEM "hwloc2.dtd">
<topology version="3.0">
  <object type="Machine" os_index="0" cpuset="0x0000000f" complete_cpuset="0x0000000f" allowed_cpuset="0x0000000c" nodeset="0x00000003" complete_nodeset="0x00000003" allowed_nodeset="0x00000002">
    <object type="Group" cpuset="0x00000003" complete_cpuset="0x00000003" nodeset="0x00000001" complete_nodeset="0x00000001" kind="1001" subkind="0">
      <object type="NUMANode" os_index="0" cpuset="0x00000003" complete_cpuset="0x00000003" nodeset="0x00000001" complete_nodeset="0x00000001" local_memory="1073741824"/>
      <object type="PU" os_index="0" cpuset="0x00000001" complete_cpuset="0x00000001" nodeset="0x00000001" complete_nodeset="0x00000001"/>
      <object type="PU" os_index="1" cpuset="0x00000002" complete_cpuset="0x00000002" nodeset="0x00000001" complete_nodeset="0x00000001"/>
    </object>
    <object type="Group" cpuset="0x0000000c" complete_cpuset="0x0000000c" nodeset="0x00000002" complete_nodeset="0x00000002" kind="1001" subkind="0">
      <object type="NUMANode" os_index="1" cpuset="0x0000000c" complete_cpuset="0x0000000c" nodeset="0x00000002" complete_nodeset="0x00000002" local_memory="1073741824"/>
      <object type="PU" os_index="2" cpuset="0x00000004" complete_cpuset="0x00000004" nodeset="0x00000002" complete_nodeset="0x00000002"/>
      <object type="PU" os_index="3" cpuset="0x00000008" complete_cpuset="0x00000008" nodeset="0x00000002" complete_nodeset="0x00000002"/>
    </object>
  </object>
  <info name="Backend" value="Synthetic"/>
  <info name="SyntheticDescription" value="numa:2 pu:2"/>
  <info name="LinuxCgroup" value="/parent/nearest/disabled/leaf"/>
</topology>
