<?xml version="1.0" encoding="UTF-8"?>
<!DOCTYPE topology SYSTEM "hwloc2.dtd">
<topology version="3.0">
  <object type="Machine" os_index="0" cpuset="0x000000ff" complete_cpuset="0x000000ff" allowed_cpuset="0x000000ff" nodeset="0x0000001f" complete_nodeset="0x0000001f" allowed_nodeset="0x0000001f" gp_index="1" id="obj1">
    <object type="NUMANode" os_index="4" cpuset="0x000000ff" complete_cpuset="0x000000ff" nodeset="0x00000010" complete_nodeset="0x00000010" gp_index="24" id="obj24" local_memory="1073741824" subtype="CXL-DRAM"/>
    <object type="Package" os_index="0" cpuset="0x0000000f" complete_cpuset="0x0000000f" nodeset="0x00000013" complete_nodeset="0x00000013" gp_index="10" id="obj10">
      <object type="NUMANode" os_index="0" cpuset="0x0000000f" complete_cpuset="0x0000000f" nodeset="0x00000001" complete_nodeset="0x00000001" gp_index="11" id="obj11" local_memory="1073741824" subtype="DRAM"/>
      <object type="NUMANode" os_index="1" cpuset="0x0000000f" complete_cpuset="0x0000000f" nodeset="0x00000002" complete_nodeset="0x00000002" gp_index="12" id="obj12" local_memory="1073741824" subtype="HBM"/>
      <object type="Core" os_index="0" cpuset="0x00000001" complete_cpuset="0x00000001" nodeset="0x00000013" complete_nodeset="0x00000013" gp_index="3" id="obj3">
        <object type="PU" os_index="0" cpuset="0x00000001" complete_cpuset="0x00000001" nodeset="0x00000013" complete_nodeset="0x00000013" gp_index="2" id="obj2"/>
      </object>
      <object type="Core" os_index="1" cpuset="0x00000002" complete_cpuset="0x00000002" nodeset="0x00000013" complete_nodeset="0x00000013" gp_index="5" id="obj5">
        <object type="PU" os_index="1" cpuset="0x00000002" complete_cpuset="0x00000002" nodeset="0x00000013" complete_nodeset="0x00000013" gp_index="4" id="obj4"/>
      </object>
      <object type="Core" os_index="2" cpuset="0x00000004" complete_cpuset="0x00000004" nodeset="0x00000013" complete_nodeset="0x00000013" gp_index="7" id="obj7">
        <object type="PU" os_index="2" cpuset="0x00000004" complete_cpuset="0x00000004" nodeset="0x00000013" complete_nodeset="0x00000013" gp_index="6" id="obj6"/>
      </object>
      <object type="Core" os_index="3" cpuset="0x00000008" complete_cpuset="0x00000008" nodeset="0x00000013" complete_nodeset="0x00000013" gp_index="9" id="obj9">
        <object type="PU" os_index="3" cpuset="0x00000008" complete_cpuset="0x00000008" nodeset="0x00000013" complete_nodeset="0x00000013" gp_index="8" id="obj8"/>
      </object>
    </object>
    <object type="Package" os_index="1" cpuset="0x000000f0" complete_cpuset="0x000000f0" nodeset="0x0000001c" complete_nodeset="0x0000001c" gp_index="21" id="obj21">
      <object type="NUMANode" os_index="2" cpuset="0x000000f0" complete_cpuset="0x000000f0" nodeset="0x00000004" complete_nodeset="0x00000004" gp_index="22" id="obj22" local_memory="1073741824" subtype="DRAM"/>
      <object type="NUMANode" os_index="3" cpuset="0x000000f0" complete_cpuset="0x000000f0" nodeset="0x00000008" complete_nodeset="0x00000008" gp_index="23" id="obj23" local_memory="1073741824" subtype="HBM"/>
      <object type="Core" os_index="4" cpuset="0x00000010" complete_cpuset="0x00000010" nodeset="0x0000001c" complete_nodeset="0x0000001c" gp_index="14" id="obj14">
        <object type="PU" os_index="4" cpuset="0x00000010" complete_cpuset="0x00000010" nodeset="0x0000001c" complete_nodeset="0x0000001c" gp_index="13" id="obj13"/>
      </object>
      <object type="Core" os_index="5" cpuset="0x00000020" complete_cpuset="0x00000020" nodeset="0x0000001c" complete_nodeset="0x0000001c" gp_index="16" id="obj16">
        <object type="PU" os_index="5" cpuset="0x00000020" complete_cpuset="0x00000020" nodeset="0x0000001c" complete_nodeset="0x0000001c" gp_index="15" id="obj15"/>
      </object>
      <object type="Core" os_index="6" cpuset="0x00000040" complete_cpuset="0x00000040" nodeset="0x0000001c" complete_nodeset="0x0000001c" gp_index="18" id="obj18">
        <object type="PU" os_index="6" cpuset="0x00000040" complete_cpuset="0x00000040" nodeset="0x0000001c" complete_nodeset="0x0000001c" gp_index="17" id="obj17"/>
      </object>
      <object type="Core" os_index="7" cpuset="0x00000080" complete_cpuset="0x00000080" nodeset="0x0000001c" complete_nodeset="0x0000001c" gp_index="20" id="obj20">
        <object type="PU" os_index="7" cpuset="0x00000080" complete_cpuset="0x00000080" nodeset="0x0000001c" complete_nodeset="0x0000001c" gp_index="19" id="obj19"/>
      </object>
    </object>
  </object>
  <support name="discovery.pu"/>
  <support name="discovery.numa"/>
  <support name="discovery.numa_memory"/>
  <support name="custom.exported_support"/>
  <info name="Backend" value="Synthetic"/>
  <info name="SyntheticDescription" value="[numa] pack:2 [numa] [numa] core:4 1"/>
  <info name="hwlocVersion" value="3.0.0a1-git"/>
  <info name="ProcessName" value="lstopo"/>
  <memtier kinds="1" nodeset="0x0000000a"/>
  <memtier kinds="2" nodeset="0x00000005"/>
  <memtier kinds="34" nodeset="0x00000010"/>
</topology>
